{
  "format": "zxv-board-manifest",
  "version": 1,
  "board": {
    "id": "qemu-arm64-virt-dt",
    "vendor": "QEMU",
    "model": "virt (GICv3), kernel loaded with -kernel"
  },
  "arch": "arm64",
  "firmware": {"type": "devicetree", "machine": "qemu-virt"},
  "console": {
    "serial": {"uart": "pl011", "base": "0x9000000", "baud": 115200},
    "framebuffer": "none"
  },
  "memory": {"ram_mib": 256},
  "hw_profile": {
    "digest": "34ec0e8229a5af72d77be2fcc1d354e90f698b239a68131583fc4425333290d4",
    "file": "../profiles/r1.zhp",
    "name": "VULPINE-class reference machine R1"
  }
}
